,tweetId,renderedContent,stance
964985,1.43E+18,On whose orders Karnal's SDM Ayush Sinha is ordering the farmers to beheaded.   Such officers should be immediately dismissed and criminal cases should be registered.  #FarmersProtest  #?????_??????_????? ,F
377807,1.36E+18,"I have a lot to say about the farmers protest, politics, power and the Stupid leaders. But you also know all those things well, that's why I am just using hastags. And I am trying to support our farmers, You also support #FarmersProtest #GretaThunberg #ModiPlanningFarmerGenocide",F
477476,1.35E+18,"   We all stand together with our farmers, our role model #FarmersProtest  #Farmers   ?",F
743448,1.38E+18,"Thank a farmer today?not only because a farmer grew the food you ate today but because farmers are fighting for all of us!!  If there are no farmers left, chances are none of us will not be left.  #????_???_?????_??? #FarmersProtest  ",F
565926,1.34E+18,"If farmers don?t stand up today, they will be silenced forever:? after meeting President over farm laws   #FarmersProtest   ? ",F
795098,1.41E+18,Farmers and  coming to the rescue where the fire broke out last night at singhu border. ??????? ???? ??? ?? ??- ig:discoverysingh  #FarmersProtest ,N
527474,1.34E+18, All corporates are forcing their employees to port there mobile numbers to . All official numbers are already ported to  #FarmersProtest  #23_december_no_lunch  #FarmActsAreUnconstitutional  #GodiMediaAgainstFarmers  ,N
189852,1.36E+18, Love ??you from the core of my heart.. Thank you so much for standing with farmers  #FarmersProtest,N
543018,1.34E+18,"On the other side "" Ghurahu "" is getting poor day by day along with his brother "" Muraahu"". New indias New Development plan creates by PM( Project Manager ). #MumkinHai #FarmersProtest #FarmerProtest #FarmersBill2020  ?",F
449999,1.35E+18,Who is responsible for Today Protest in Delhi?  #FarmersProtest #?????_????_?????,N
46138,1.37E+18,I was driving since 2 hours and had one  I'm ready too to kick on theirs butt #NoVoteToBJP #FarmersProtest ?,F
283468,1.36E+18,   I can bet Their routine reply will be ?no such information available with us? world is very well aware that these shameless  bunch don?t have spine #FarmersProtest,F
666930,1.40E+18,Sumit Nagal fails to make it to French Open main draw - Sportstar#farmers #farmersprotest,N
990036,1.43E+18," Today, on Independence Day, farmers will stage peaceful Tiranga Marches nationwide reiterating their demands to Repeal Farm Laws & enact guaranteed law for MSP #????_????????_???_?????_??  #????_????????_??_??????_??  #FarmersProtest ",F
38129,1.37E+18,"Say what you have to say with conviction. Standing up for human rights requires you to speak up, silent disagreement just don?t count! #NeverForget84 #Sikhs #WeDontStop #FarmersProtest ",F
211427,1.36E+18, It?s so kiddish of him #FarmersProtest,N
745521,1.38E+18,"Protest will continue until these black laws are repealed , We will not stop fighting until we win #Farmers_vs_BikauModi #FarmersProtest ",F
580477,1.34E+18,Early morning visuals from Ghazipur border. #FarmersProtest #BharatBandh   ,N
249589,1.36E+18,"I see a huge increase in posts related to #farmersprotest after #Rihanna posted on  Even people who had their mouths duct taped about this before. So, is everything?s just about trend these days ? My people know what I am talking about ?? #KisaanMajdoorEktaZindabaad",F
602495,1.33E+18,#kisanandolan #FarmersBill2020 #FarmersProtest #KisanVirodhiNarendraModi #Farmers  #GHMCResults     see how these shit news channels #GodiMedia always run their propaganda. They are true the real VIRUS. ?,N
617484,1.33E+18,"?We are farmers, we are not terrorists.?  #FarmersProtest #FarmBills2020 ",F
164039,1.36E+18,"U talked of our plight Brought us to limelight Were sitting in the dark Ur tweet gave us spark No water, no net Our supplies were cut We are peaceful, they are rude NO FARMERS, NO FOOD You rock from Dehi to Savannah O' Rihanna, O' Rihanna   #FarmersProtest ?",F
208456,1.36E+18,India is not a democratic country anymore . Ruled by RSS and big businessmen . #FarmersProtest #shameonindiangovt ?,F
636237,1.33E+18,Harsimranjeet02: Thank you Amrinder gill  #FarmerProtest #standwithfarmerschallange #FarmersProtest ?,N
68346,1.37E+18, This is how Modi bhakts reacting when they seeing Twitter trends of farmers  ( ???? ????? ?? ???? ??????? ???)  ???????DEG TEG FATEH ??????? ???????????????????????????? #FarmersProtest  #ModiRaidsProFarmers ,F
484868,1.35E+18,"Modi government, farmers in waiting game? Watch this and more only on #NewsToday at 9 PM with .  #Promo #FarmLaws #FarmersProtest ",N
166748,1.36E+18,"Stay strong and support each other as much as you can, unity is key. We are praying!!! #FarmersProtest #farmersprotest #ReleaseNodeepKaur #ReleaseDetainedFarmers #ReleaseRanjitSingh Spread awareness about black farm laws, human rights violations. Most important spread love ??.",F
684040,1.39E+18,  Every farmers of India will loose everything after these black farmers laws. And also we trusting of farmers leaders. We will fight till our last breath. #FarmersProtest  #BjpDestroyedIndia ,F
348583,1.36E+18, You are right sir indian gov is killing democracy be ready for next dictatorship #FarmersProtest #HumanRightsWatch #HumanRightsViolations #SikhLivesMatter ,F
770182,1.42E+18,28 ???? 800 tweet done in one hour Trending no 2 Keep supporting Tweet n Retweet  #WhyBJPhatesFarmers #FarmersProtest,N
481490,1.35E+18,Love food support farmers #FarmersFightUntilWin #FarmersFightUntilWin  #WorldSupportIndianFarmers  #FarmersProtest         ,F
751994,1.38E+18,Discussions were held in each of these villages on the 3 Anti Farmer Laws brought in by BJP Govt & as a form of protest these pots of soil where gathered and taken to Delhi Border to participate in #FarmersProtest in by the RSV team.    ,N
990733,1.43E+18,Tweet | RT | Share | Spread   #????_????????_??_??????_?? #FarmersProtest,F
614346,1.33E+18,Agriculture is the main backbone of our country. So they should get what they deserve!!! #PunjabFarmers #Punjab #FarmersAbovePolitics #FarmersProtest #FarmersDilliChalo #FarmersBill2020 #FarmersDelhiProtest #istandwithfarmerschallenge #StandWithFarmerschallenge ,F
694746,1.39E+18,"The 26-year-old daughter of Bengal, who came to join the  farmers protest  was raped by 4 agitators .A case has been registered against all the accused.  #FarmersProtest ",N
271502,1.36E+18,"#JagranNewsAlert | For more on this, visit   #RajyaSabha #FarmersProtest ",N
500122,1.34E+18,Lone BJP MLA in Kerala backs Assembly resolution against new farm laws #FarmersProtest #Kerala ?,F
789924,1.42E+18,#ReleaseAllPoliticalprisoners   #ReleaseAllHumanRightsDefender including farmers / peaceful protestors - that have been unjustly detained.   The right to peaceful protest is a democratic right!  #FarmersProtest 2dissent2?,F
395729,1.36E+18,"   Yeah  is making sure that everyone believes in corona & get injected. Virus is fake, the best example is #FarmersProtest . Not even a single corona patient. These fake politicians are just advertising it.",N
396853,1.36E+18,Thanks a lot  for raising your voice for #FarmersProtest   ,N
251604,1.36E+18,"#FarmersProtest  We love ????, yet all this. ?",N
312436,1.36E+18,The faces of #Farmers ?? #FarmersProtest ,N
113885,1.36E+18, Love their spirit.   #FarmersProtest #RailRokoForFarmers #RailRoko,F
912568,1.44E+18,#???_???_??? #??_????_???_??  #FarmersProtest  #FarmersProtest_StandsStrong  Who did this ?????? Thay are useless and anti-national?? who make that video? ???? We all should respect our prime minister ?? Ye desh virodi gatividhiyan nhi chalegi ?? ???? ,A
312839,1.36E+18, Dont try to interput our internal issues we are more capable then any other country to solve this issue   #breakingindiaforces #fakefarmersprotest   #FarmersProtest,A
234395,1.36E+18, Female farmers r protesting against3 Agri.billsinIndia at Delhi boarders.Oneof them was lateSmt.Sitabai tavi fromNandurbarMaharashtra died duetocold.Verysad!.#FarmersProtest#RihannaSupportsIndianFarmers  #CretaThunberg #NareshTikait #ShivSena    ,F
205266,1.36E+18,Return gift from Jay shah for tweet ??????  #FarmersProtest ?,N
723195,1.39E+18,MR MODI RESPONSIBILITY IS ACCEPTING THAT YOU ARE THE CAUSE AND THEN WORK FOR THE SOLUTION  OF THIS MESS...  #????_????_????_??????_??? #ModiMadeDisaster  #FarmersProtest,F
285315,1.36E+18,"  Humanity do not  need words. To stand for what is right,it takes guts and soul that i am sure you have sold and choose   Modi and Rss slavery SHAME ON YOU ANDH BHAGAT #FarmersProtest",F
106674,1.36E+18,  Tweet Retweet  #DPstopIntimidatingFarmers  #MSP_?????_??_??  #FarmersProtest  #FreeDishaRavi,F
376491,1.36E+18, You are very quick to ban accounts of those who support farmers but now  called farmers a terrorist. Hope you ban his account. #FarmersProtest ,F
631336,1.33E+18," #FarmersProtest they are our sons , our brothers , our family?s so that?s there duty it?s ok so shut up your mouth andh Bhagat",F
670137,1.40E+18,"For women farmers, it's black flags instead of masks  #Farmers #BlackFlags #FaceMasks #KisanAndolan #KisanSangharsh #KisanEkta #KisanEktaZindabad #KisanMazdoorEktaZindabad #KisanProtest #KisanAgitation #FarmersProtest #FarmersAgitation  50EUsPa",F
193322,1.36E+18,Thank  India stands with farmers #FarmersProtest ?,F
291350,1.36E+18,Tents moved to make way for ambulance at #GhazipurBorder | #FarmersProtest #FarmLaws |    ?,N
402342,1.36E+18," TRUMP should have consulted his friend MODI on how to build a WALL. Only difference is Trump wants to build wall so that immigrants can't get in USA, whereas MODI building it so that its own Citizen can't get in and out of DELHI #FarmersProtest  #ModiPlanningFarmersGenocide",F
304736,1.36E+18,????????huge respect for all of you supporting from all over the world. We will remember this our whole life. #FarmersProtest #isupportfarmersprotest #IStandWithFarmers #FarmerLivesMatter #SikhLivesMatter ?,F
136098,1.36E+18,"Follow the thread on updates from PC of the legal team of Farmer Unions.  The team, headed by S. Prem Singh Bhangu, is working to get justice to the protesters arrested on Jan 26 & from different sites.   SKM will provide legal and financial aids to detainees.  #FarmersProtest",N
390713,1.36E+18,"Killing people and making fun of constitution and rights of people who live in worlds largest democracy. We are protesting by providing food to all, giving them commodities. Keep your eyes close and mouth shut. Rest In Peace    #FarmersProtest #WeSupportFarmers",F
990595,1.43E+18,Support farmers.  Save food. Save future. #????_????????_??_??????_?? #FarmersProtest,F
398996,1.36E+18,"Thank you   you may face a lot of threat DMs or biased news articles from paid indian govt media after this, but please stay strong and keep supporting farmers protest in future.. we need help as govt is suppressing #FarmersProtest to much! #RihannaSupportsIndianFarmers ?",F
8674,1.38E+18,"   Also what is the amount of force that has been exerted on the farmers? If they were wrong, then it would have been easy to say, but shutting down internet, stopping people, jailing journalists, burning pictures of people who support #FarmersProtest_BharatBandh #FarmersProtest",F
911319,1.44E+18,"Stand with the farmers, stand for saving the nation...!!  #FarmersProtest #ShaheedBhagatSingh",F
935270,1.44E+18,Indian Taliban leaders Oops farmers leader reality! #FarmersProtest #VinayakaChavithi #fridaymorning ,F
40703,1.37E+18,#??????_?????_????_???? #FarmersProtest  This RSS run BJP must be removed from power.They are a direct threat to democracy.They are a bunch of fascists and ruining the country.Use your vote wisely and stop ?? BJP.Support #Farmers who feed the nation and suffering. ,F
738539,1.38E+18,  Farmers protests did it. They disclose the reality •f these three friends. The power of truth. #FarmersProtest,F
764525,1.38E+18, Great :)   Alone we can do so little; together we can do so much.?ÿ? Helen Keller  #FarmersProtest #????_??????_?????_??,F
881252,1.41E+18,"Do we remember #FarmersProtest is still going on. The protest is for your benefit. Just see how the prices of pulses, edible oil and vegetables are inflating.",F
720915,1.39E+18,"Modi Bjp govt playing politics and letting people die instead of making efforts to save lives.  Get rid of corrupt, good for nothing 'killer' Modi BJP govt.  #MSP_is_Farmers_Oxygen  #FarmersProtest  Raise voices. Raise awareness. REPEAL black farm laws. Give MSP legal Guarantee. ?",F
237866,1.36E+18,Thnk uh  U r real kkk? #FarmersAreIndia  #FarmersProtest 2803/st?,N
547202,1.34E+18,My india.  #farmersprotest #BoycottJioSIM #??_???_?????_????_?????? #BoycottPatanjali  #ModiSellingFarmers 3141/sta?,F
547589,1.34E+18,"""We do not fear the cold here,"" protesting farmers tell NDTV's Arun Singh in Rewari, Haryana-Rajasthan border #FarmersProtest ",N
650125,1.33E+18,Punjabis fought against Mughals  Punjabis fought against Britishers. Freedom fight started only when Britishers came in Punjab after 100 years of ruling rest of India   Now it?s Modi Govt?s turn   #FarmersProtest #FarmersDilliChalo #DilliChalo,F
719261,1.39E+18,#???????_???? #IndiaNeedsOxygen #ModiAbandonedIndia #ModiOxygenDo #BJPFai #FarmersProtest #???????_??_???_??  #????_????_????_???????_???? Modi Govt has paralyzed the Indian Economy. goes to Modi who has been fooling 135 crore people for 8 years continuously #??????_?????_?????? ,F
274855,1.36E+18,Thank you #SonakshiSinha ji #IndianFarmersHumanRights #shameonbollywood #AntiNationalBollywood #IStandWithFarmer #ISupportFarmers #FarmersProtest #westandwithfarmers ?,F
469237,1.35E+18,Farm laws will help increase farmers? income manifold: Amit Shah  #FarmLaws #AmitShah #Karnataka #FarmersProtest  ?,N
514843,1.34E+18,Brutish attempt by  Uttarakhand ?? to ?? peacefully marching farmer to Delhi.The protest was againest agriculture laws.#FreeFarmersFromCorporates #FarmersProtest #Standwithfarmerschallenge  #SpeakUpForFarmers  #iamwithfarmers  #Tractor2Twitter  #isupportfarmers,F
503037,1.34E+18,#zeenewsFakeNews #ZeenewsFakenews  #Bycott_adani_ambani #FarmersProtest #BoycottJioSIM #BoycottPatanjali #Bycott_EVM These channels are shame on democracy ,N
894078,1.40E+18,#200_???_?????_?????? #Support our #farmers. Don't leave them alone. #FarmersProtest #?????_????_???????? #TwitterStopHarassingFarmers ,F
320056,1.36E+18,Farmers feed the world but not Bhakts ??????. #FarmersProtest,F
495020,1.35E+18, may be busy with parrots and peacock.  Salute to all Shahed. An 18en years old boy at Tikri border also Shaheed. #FarmersProtest #RepealThreefarmact ? ,N
199046,1.36E+18, ???? Glad to hear from you  Bhakts are confused nowadays  #FarmersProtest #supportfarmers,N
344332,1.36E+18, thanks for supporting us #FarmersProtest ?,F
980521,1.43E+18,When BJP Rejects Nation and supports and corporates  We #RejectBJP_SupportFarmers #FarmersProtest  ..............................................,F
766040,1.38E+18, COVID drama Muslim and Sikh Nishana #Hindutva regime - #Godimedia #FarmersProtest,N
1012050,1.42E+18,"80% of today's media channels are created, controlled and run by Corporates. Rest 10-15% are controlled by govt through Pegasus, threats and money.  And you guys still expect unbiased media?  #ModiMedia_HatesFarmers  #FarmersProtest",F
712214,1.39E+18,"      Dude, we should lift us common Indians up instead of worshipping these dumb heads! We should learn now! #FarmersProtest",F
580084,1.34E+18,Today Indian close #FarmersProtest #??_????_???_?? #???_??_?????_???,N
138447,1.36E+18,Modi Don?t Use God Shiri Ram G for your Vote Bank   Stop spreading Religious Hate in India  And Repeal Black laws  #??_????_??_????? #???????_??_???????_?? #RepealOnlyWayAhead  #FarmersProtest ,F
119033,1.36E+18,Government's cheap policies can't stop us to take Our Rights We will Fight We Will win.. 29 #FarmersMakelndia  #FarmersProtest,F
566812,1.34E+18,"#FarmersProtest I Farmers reject govt's written proposal, threatens to block Delhi-Jaipur highway by Dec 12  ?",F
391702,1.36E+18, Thank you for supporting farmers.  Many people gonna be against you now but remember truth is above thn anything.  #FarmersProtest #IStandWithFarmers #farmerslivesmatter,F
553111,1.34E+18,Amazing work ???? #Boycott_JioSaavn #farmersprotest ?,F
713891,1.39E+18,"The RIGHTS of every man are diminished when the RIGHTS of one man are threatened.  If you eat food, this is your protest too.  Support farmers??  #FarmersProtest   15:28:10",F
931589,1.44E+18,#FarmersProtest against new farm laws.   BJP Government is not responding to repeal the black farm laws and legalization of farm produce MSP.  Why?   Is it like #MiddlemanModi_AgainstFarmers ,F
916349,1.44E+18,"#??_????_???_???? is a symbol of UNITY, courage and determination to ensure that we are all together with the #FarmersProtest  and their peaceful protest going on for the last 10 months on the outskirts of the capital city.",F
438261,1.35E+18, Why sir you are having a press conference only arrest him and put him in the jail if your government can do #FarmersProtest,N
169234,1.36E+18,"True face of a Country without #Humanity or #Shame. He is not looking for a revolution, He just wants to be treated Humanely. Stay Strong Grandpa!! #FarmersProtest ",F
184858,1.36E+18,"23-year-old Nodeep Kaur, a Dalit Trade Union activist, was arrested by Haryana police from the Singhu border on 12th January. She is paying for supporting farmer's protest. #SpeakUpForNodeep #FarmersProtest ",F
190055,1.36E+18,"Is it a coincidence that within 24 hrs of restoration of #4G, a #Kashmiri #Terrorist of Jaish-e-Mohammed nabbed in #Jammu and that too few meters away from a #FarmersProtest site. Commendable job by our jawans of  but we as citizens also need be vigilant and report. ",N
633554,1.33E+18,Retweet this and bring justice to farmers  #FarmersProtest #TakeBackFarmBills #KisanProtest ?,F
71896,1.37E+18,Cowards need to be called out!  #FarmersProtest 2?,F
277926,1.36E+18,We support farmers' protest  #shameonbollywood #FarmersProtest #IndianFarmersHumanRights,F
936636,1.44E+18,"Karnal still not have access to internet yet. Why government is fearing from the farmer. Howsoever they oppress farmers ,they can't be burried down. #FarmersProtest #KarnalProtest_AgainstLathicharge #JusticeForKarnalFarmers",N
443018,1.35E+18,"What about stooges like ? Who tried to sabotage the #FarmersProtest, any word on that?  #Farmers #Facts #FarmersProtestHijacked #KisanoKaGUNtantra #KisanAndolan ?",N
210131,1.36E+18,  I hope  isn?t your local MP   what a disgrace the fella is and even has a picture of Modi in his bio.   #FarmersProtest,F
42571,1.37E+18,This is how the farm movement is growing. 17 farm unions in the hilly state of Himachal Pradesh come together.  #FarmersProtest ,F
313037,1.36E+18,"My name is Saleem Nazeer. I""m from #Pakistan & I stand in complete solidarity with the #FarmersProtest !! ????  Indian Farmers are NOT alone in this. Our prayers & support is with them! ??  #WorldSupportsIndianFarmers",F
885720,1.41E+18, Thank you sister you felt my pain #FarmersProtest,N
246952,1.36E+18, Please help spread the word about the Indian farmers' struggles.  #farmersprotest #KisaanMajdoorEktaZindabaad  ?,F
396031,1.36E+18,"When a Peaceful protest meets with government?s manipulation.   Than protester might seem aggressive, riot-like situation, and much more. But even after all the injustice, cruelty - protesters are maintaining peace. #FarmersProtest #peacefulprotest 135?",F
374075,1.36E+18,"  When was the last time you spoke against #farmbills2020? Their livelihood is at stake and #FarmersProtest are on streets since september 2020 in the shivering cold. Yet Mr.Modi uses police force, internet shutdown and arrest reporting journalists to shove down the farm bills.",F
134265,1.36E+18,These BJP leaders are so shameless.The power will not stay forever in one hand. #FarmersProtest  #RepealOnlyWayAhead  #IStandWithFarmers ?,F
946840,1.43E+18,"This mahapanchayat is not just linked to elections. In UP, farmers are facing hardship. Besides the power tariffs, the sugarcane price hasn?t gone up since last 2016. The Centre has increased it by five rupees, five paise per kilogram. Are you insulting farmers? #FarmersProtest ",F
956244,1.43E+18,The people who raise the real public issues and criticise the government are tagged as anti-nationals.  #FarmersProtest #BJPCannotDivideFarmers ,F
530247,1.34E+18,"Its called Empathy and respect for Fundamental rights of other citizens. Something which is disappearing day by day from our joke of a political class, public discourse and God forsaken  Media of our country. #FarmersProtest #FarmersBill",F
358775,1.36E+18,Because of BlowJob party want to turn India into a dictatorship   #FarmersProtest ?,N
131962,1.36E+18,"Hey #Farmers of #Tamil adu - don?t ever forget, #Modi made you eat rats in #Delhi and never found time to hear you. Defeat even those who join hands with him. Never forgive him. #FarmersProtest  PM Narendra Modi Applauds #Farmers Of Tamil Nadu ?",F
121450,1.36E+18,United we stand! #RememberSirChhotuRamInModiEra #FarmersProtest ?,F
801410,1.41E+18,#FarmersProtest  ? Are we now just accepting Jio Saavn? Bas Ankh finished? Paisa wins! ,N
672044,1.40E+18,Bang on target sir.... BRAVO   #Modi_Nahi_Kisan_Jitega  #FarmersProtest ?,N
676580,1.40E+18,Today iz 21st Day Of 21st Week of 21st Year of 21st Century..!  Friday ??st May ????  #FarmersProtest ,N
276553,1.36E+18,   They can restrict us but we will not be silenced or repressed #IndianFarmersHumanRights #FarmersProtest,F
491329,1.35E+18,The world is watching. Indian propaganda no longer working in keeping the people submissive to a puppet dictator PM.   Jai Bharat Mata!  Jai Hind!  #KisanNahiToDeshNahi  #FarmersDealTotalRepeal #FarmersProtest ?,F
545594,1.34E+18,Don't worry about yesterday's Think about Today and Prepare for Tomorrow's #wednesdaythought  #WednesdayMotivation  #FarmersProtest ,F
174281,1.36E+18,"Boring ass super bowl. But if I'm a Fresno resident, I'm happy with the results regardless of the score.   #FarmersProtest  #SuperBowlLV",N
724834,1.38E+18," Ambani hired tweeters have already started. Fake news on #FarmersProtest  Making fake news out of the misery that India is suffering . Time to be united not ""Divide and Conquer like the British Empire. If u have so much money to spare feed the migrants. Farmers are feeding them.",F
623176,1.33E+18,#farmersprotest #farmersprotest #standwithfarmerschallenge #ModiKisanVirodhiHai save Farmer ?,F
577060,1.34E+18,#FarmersProtest #BharatBandh #BharatBandh: #Farmers continue to block #NH24 ,N
790187,1.42E+18,"The #Farmers who giving the  food, are sleeping on roads for their rights nd nobody listens to them. #SFJ #FarmersProtest  #Indian #ParliamentForFarmers #Khalistan       ",F
430162,1.36E+18,Mob linching by Amit Shah's Delihi Police #IndiaVsPMModi  #indiavsmodi  #farmersrprotest  #FarmersProtest ?,F
625593,1.33E+18,"Amit Shah, Top #BJP Leaders Meet Late Night On #FarmersProtest: Sources #AmitShah ?",N
311002,1.36E+18,"When the entire world stands for  government, our system, built a Barlin Wall and behaves farmers are outsiders #FarmersProtest #shameongodistars #ShameOnGodiMedia ",F
239567,1.36E+18,    They are trying to suppress the voice of the farmers instead of listening to them #FarmersProtest,F
605338,1.33E+18,No Farmers No Food. #isupportfarmersprotest #Farmers #farmersprotest #supportfarmers,F
468051,1.35E+18,"Gurnam charuni was nd is part of sanyukt kisan morcha. We are closing this matter here only, he will be part of tomorrow?s meeting with centre govt #FarmersProtest",F
639054,1.33E+18,This guy is a perfect example of how the elites think about rest of india and its people. They need to understand that english is just a language like any other language and it's not only talk between the rich and upper class. #FarmersProtest ?,F
583549,1.34E+18,"'Bharat Bandh': Central Govt Issues Advisory, Orders To Tighten Security #BharatBandh #FarmersProtest  ?",N
1012144,1.42E+18,"Corporate?s hired Media is Presenting the Negative Image of Farmers...   It Our Responsibility to paint True Image of Farmers? Protest on Social Media and Support Local Media.  We need a Media that spreads Radical Love, not Radical Hate..  #ModiMedia_HatesFarmers #FarmersProtest",F
167809,1.36E+18,"  #andolanjivi Do you think bhagat singh was andolanjivi ??????? This is how BJP respect great souls WHO GAVE UP THEIR LIFE FOR FREEDOM #FarmersProtest   Hello bawa ji and jazzy pazi please share, now they are making fun who gave their life , its really disappointed sppech by pmodi ",F
296663,1.36E+18,?? Trending Hashtags on Twitter by Tweeplers: ? #FarmersProtest  is trending at No. 4 on the twitter in the ?? World via   ?,N
698818,1.39E+18,Repeal corporates favoured laws!  #FarmersProtest #FarmLawsAreNotReforms ,F
161166,1.36E+18,"206+ farmers have died not because of any tragedy or they commit suicide, BJP forced them to die  #FarmersProtest #Farmers",F
349306,1.36E+18,#FarmersProtest Here comes another one supporting the Government and the abuse on #FarmersProtest #BoycottBollywood Don't most of Bollywood's income come from farmers and films abroad in cinemas? ?,F
560126,1.34E+18," #FarmersProtest  What is common in             Harshad Mehta,    Mehul Bhai, Ketan Parikh.  Answer is  all are Gujarati thugs. Be careful India went into wrong hand.Only god can save this India.",F
27089,1.37E+18,  Hey ... woman power of India ... throw this CM out ... NOW .  Retweet ... like ... share and join the Andolan against these GUYs. We can and will Do It . #ThrowoutAbhayChautala  #RumiRotiFight #RippedJeansTwitter #FarmersProtest #kisanektazindabaad,F
