,tweetId,renderedContent,stance
717998,1.39E+18,"A tyrannical ruler yearns for absolute power and authority (*undemocratic* / anti-livelihood / unjust / illegal farm laws)...    often applies that corrupt power unjustly, inhumanely, cruelly, and oppressively.   #FarmersProtest  #????_?????_??????_????? ?",N
294682,1.36E+18,"They use same vocabulary, because BJP IT provide them material which they have to publish only from their twitter handles. #shameonbollywood  #FarmersProtest  #IndianFarmersHumanRights 2748085?",F
447859,1.35E+18, You are responsible for today's violence #FarmersProtest,N
97428,1.36E+18,"Good morning, good evening, good night everyone. Hashtag for today is #Pagdi_Sambhal_Jatta use this not other hashtags it would also be helpful if you used #FarmersProtest 2",N
84512,1.37E+18, had it not been you or  or  or any other celeb #FarmersProtest Must have been a success instead of coming to the verge of a violent protest. just bcz of gaining audience you guys have lowered yourself to the worst humanity can go,N
778118,1.42E+18,Thanks for joining the moment yesterday ???  Keep supporting the Farmers. They need our voices and all opposition parties should extend their support.   #FarmersProtest ?,N
481479,1.35E+18,"  #AntifaTerroristsStormedTheCapitol in the US , who hijacked #TrumpSupporters  I think #LeftistMindsets of #XiJinping are active every in the world. In India, the same #LeftistMindsets #Khalistanis fuelled by #XiJinping have infiltrated in #KisanAndolan #FarmersProtest.",N
433529,1.35E+18,           #?????_?????_????_?? #????_????_?? #?????_?????_???????_??_????_??  #RakeshTikait  #FarmersProtest  #farmerprotest #gazipurborder  #???????_??????  Copy Paste RT,N
888707,1.41E+18,"Singhmanjeet_: When Godi Media starts cooking stories against farmers, farmers start cooking langar for humanity. #FarmersProtest #Tractor2Twitter ?",F
37457,1.37E+18,Apt comparison Modi is like Hitler #FarmersRoarInBengal  #FarmersProtest ?,F
400291,1.36E+18," Hi Rihanna thank you to address this current issue in India, we stand with you and we are sure that you have tweeted after reading the reality of this United protest, Many media channels around the world have spoken about this, yet it is denied as genuine effort. #FarmersProtest",N
571787,1.34E+18,Things happening in India rn  #thecurrent #savepunjab #FarmersProtest #FarmerProtestHijacked #FarmerProtestDelhi2020  2HUEo/?,N
546826,1.34E+18,"Hello, I'm a farmer bot trying to spread awareness about the largest ongoing peaceful protest led by FARMERS of India.  RT to support farmers and spread this message across the world. ??    #FarmersProtest  #ModiSellingFarmers #WorldStandWithFarmers    06:12:47",N
482857,1.35E+18,We will be live-tweeting the Asia Pacific Solidarity Forum in support of farmers' movement in India!  Co-presented by the Asian Peasant Coalition  & moderated by our executive director   #FarmersProtest,F
351979,1.36E+18,"Breking news: - Mia and Johny Sins  performing live show  at Delhi near khalistani tent,  #FarmersProtest",N
162773,1.36E+18,"25xg ""We didn't know, what to call BJP netas who used to do a lot of #Andolan s in #Maharashtra, now we have a word #andolanjeevi""..Have you watched this speech by Mr. ..?? Awesome, to the point and eye opener for the ruling party.. #FarmersProtest",N
320001,1.36E+18,  Very true. More power and respect to Rihanna and voices like hers. #FarmersProtest,F
334221,1.36E+18,#FarmersProtest #FarmersProtestNews #KisanBills2020 #BKUEktaUgrahan #KisanUnions #PunjabFarmersNews #DelhiChalo #PunjabGovernment #CentreGovernment  #DilliChaloAgitat#khanauribordersealion #HaryanaBorder #KhanauriBorderSeal #FarmersProtest #agriculture #PMNarendraModl #TRAIN ,N
98197,1.36E+18,"1inaMillion08: It's not a matter of `if`, it's only a matter of `when`. Let's all stay strong ?? #FarmersProtest #StandWithFarmers #Tractor2Twitter 1inaMillion08/?",F
618992,1.33E+18, That is how you counter when someone shows you the real picture. Anyways good luck with your love for BJP and Modi! I wish you were UNBIASED!        #Farmers #farmerprotest #FarmersProtest ,N
710230,1.39E+18,Courage isn't the absence of fear. It's the acceptance of fear and the willingness to move forward. #FarmLaws_NextPandemic #FarmersProtest,F
383902,1.36E+18, haven't heard in a while.. Good content for next show????#FarmersProtest ? ,N
487129,1.35E+18, you can?t hide! The time has come for you to do the right thing otherwise you will never be forgiven #farmersprotest ?,F
724747,1.38E+18,"Still, No talk about Kumbh?? #FarmersVsModiVirus #FarmersProtest ?",N
239706,1.36E+18, Thank you for your support. #FarmersProtest,N
729898,1.38E+18,"Instead of doing rallies in Punjab , why SKM leaders don't set up a hospital at borders and arrange all the necessary things at borders site for COVID emergency so we can answer govt officials that we have all precautionary measures #FarmersProtest",F
105770,1.36E+18,No one was buying Arjun Tendulkar then Nita Ambani bought him at a base price of Rs 20 lakh. Now explain to Sachin Tendulkar that his son has been bought on MSP. Farmers are also demanding the same MSP guarantee.    #DPstopIntimidatingFarmers #FarmersProtest ,N
372292,1.36E+18,Swara Bhaskar's job is at risk after Rihanna's tweet..!!!?????? #swarabhaskar #RIHANA #FarmersProtest #KisanAndolan,F
62623,1.37E+18,"If you can?t afford petrol, try filling your tank with gau mutra ????????  #PetrolDieselPriceHike  #FarmersProtest",N
945193,1.43E+18,  Can any andhbhakt tell me that what would have happened so far if the farmers had agitated not like Mahatma Gandhi but according to the mentality of Nathuram Godse? #?????_????_???????? #??????????? #???????_??????????_??? #KisanMahaPanchayat #FarmersProtest,F
513429,1.34E+18," #JJP #harindersinghkhalsa  SAD, RLP n now Harinder Singh Khalsa  What are you waiting for ???  #FarmerProtest #FarmersProtests #farmsbill2020 #FarmersProtest #FarmLaws2020 ?",F
337742,1.36E+18,The chief clowns of the obnoxious Bollywood circus who could'nt let go of any opportunity to show themselves as relevant (but with a safety net) have all responded. (1/2) #FarmersProtest,F
47271,1.37E+18,Support Farmers. Stand with TRUTH. Time to ACT is NOW. Raise your voices.   INDIA needs CHANGE. GET RID OF BJP.  #IndiaFights4FarmerRights #FarmersProtest,F
214868,1.36E+18,So they say  was paid to post in favour of #FarmersProtest but nobody is telling how much     got to write against them?,F
100598,1.36E+18,India targets Canadian because he used his right to free speech in order to expose India #FarmersProtest ?,F
715059,1.39E+18,"Entire families have come together for the journey to join this movement. It's not about us, it's about those around us and the generations to come. Nothing will stop the #FarmersProtest until these three laws are repealed.   #??_???????_??_????_??????   Tweet / Retweet maximum ",F
638140,1.33E+18,"Farmers are not doing any favour to our country. They get many extra benefits from Govt to run their business. And they don't sell 'ration' for free!  Any why only ""Middle Class"", Upper/ Lower classes photosynthesis kar lega kya?!   #FarmerProtest #FarmersProtest #FarmersProtests ?",F
196409,1.36E+18,#FarmersProtest #FarmerProtest #KisaanMajdoorEktaZindabaad #StandWithFarmers Thank you Caribbean Queen   ... like diamonds in the sea ,N
509399,1.34E+18,  Muslim activist with Hindu Activist at #SinghuBorder  #FarmersProtest #mojo #kisanandolan  ,N
253255,1.36E+18,"As  reminds us""  ?If you're not careful, the newspapers will have you hating the people being oppressed, and loving the people doing the oppressing.?  ~Malcolm X ? #FarmersProtest #Kashmir #KashmiriLivesMatter #KashmirSolidarityDay ",F
306914,1.36E+18,The Hindu Indian Government has been Cruel with the Muslim Community in Kashmir for decades. Now these atrocities are also being done to the Sikh Farmer Community.  #WorldSupportsIndianFarmers #Khalistan #WeWantKhalistan  #FarmersProtest,F
497667,1.35E+18,Why Bhakts are jealous of #FarmersProtest ?  #TakeBackFarmLaws2020 #ModiRepealFarmActs #ModiHitlerAgainstFarmers #khalsaaid #zeenewsboycott,F
64101,1.37E+18,    First of all thr is no sir  is hallucinating is quite clear aftt ur comment ?? #FarmersProtest100Days #FarmersProtest,N
550914,1.34E+18,If there is huge mismatch in ordered EVM and delivered EVM then why no one is raising voice.  Mumbai based RTI activist revealed the data collected through RTI act. For sure EVM is fraud.  #FarmersProtests #FarmersProtest  ?,N
445120,1.35E+18,Is this #FarmersProtest proof?  #DelhiUnderAttack ?,A
799610,1.41E+18,"Cabinet reshuffle Live Updates: Big resignations continue, Health minister Harsh Vardhan quits too - Economic Times#farmers #farmersprotest",N
435680,1.35E+18,"Heavy #police deployed at #Ghazipurborder with tensions at the site, section 144 has been imposed and heavy force has been asked to stay alert #UttarPradesh #FarmersProtest #RakeshTikait #uppolice #IndianRepublicBlackDay   ",N
668848,1.40E+18,  Yup he's a Kuta baadmash! #6MonthsOfFarmersProtest #FarmersProtest = #HumanRights,F
909544,1.44E+18,"Tomorrow captain will join #BJP #CaptAmarinderSingh, Farmers protest will be over soon. #FarmersProtest",A
77532,1.37E+18, Isn?t she the one usually supporting Modi ?? Sorry they all look the same who speak really fast and they think they can make right a wrong by talking fast. #FarmersProtest,N
725462,1.38E+18,#FarmersVsModiVirus  ? Modi Virus is becoming ?Lethal? and with every passing day for : : -Farmers  -All Indians  -Underprivileged  -Middle class  -Students  #FarmersProtest ,F
881822,1.41E+18,"Farmers protest is not a trend, don't forget about them Please continue to raise your voice for them???? #????_?????_???????_??_???  #????_?????_???????_??_??? #BanGrahanWebSeries  #????_??_????_?????_??_????  #????_?????_???????_??_???  #FarmersProtest ",F
679380,1.40E+18,Life on a farm is a school of patience; you can?t hurry the crops or make an ox in two days.  #ModiDestroyingFarmers #FarmersProtest,F
579250,1.34E+18,Humein bhi tho samjawoo kyu oppose kar rahe ho aur bill ka documents share karke usme highlights karo jo aap log oppose kar rahe ho ?????? #FarmerProtestHijacked #FarmersProtest #FarmLaws #FarmerPolitics,A
138740,1.36E+18,Government should take the black laws back  #RepealOnlyWayAhead #FarmersProtest ,F
633088,1.33E+18,"Exposing the motivated, neo political breed of what may be called 'agitational farmers'!  Aimed at harvesting certain #VoteBanks through manipulation in cahoots with an embedded #PaidMedia by #Modi baiters.  ?? #FarmersProtest #FarmersDilliChalo #FarmerProtestHijacked ?",N
130933,1.36E+18,How can India negotiate with protesting farmers when they cherry pick and throw some of their leaders in jail?    #FarmersProtest #istandwithfarmers #farmerrights #humanrights #KisaanMajdoorEktaZindaBaad #ReleaseDetainedFarmers #,F
308001,1.36E+18,"In your dreams????. Open your ears/ eyes so then you can hear and see on whom, the whole world is laughing.   They are real stars. ????    #FarmersProtest 1/stat?",F
680472,1.39E+18,#FarmersProtest Yet another Andhbkats have found mantra to get rid of Corona. Watch for yourself....... ,F
638133,1.33E+18,?? The Man again ?? ??   #YogendraYadavforPM #FarmersProtest ,N
964726,1.43E+18,"  They may torture my body, break my bones, even kill me, then they will have my dead body. But not my obedience! -Mahatma Gandhi #?????_??????_????? #FarmersProtest  #?????_??????_?????",F
145718,1.36E+18,"BJP try to control our voice on social Media.  Here...! We are the Voice of Farmers. We are the Voice Of Truth. Stay strong, stay together.  #FarmersProtest  #BJPGovtDectatingTwitter ",F
90831,1.36E+18,I support Indian students #modi_job_do do u ? #FarmersProtest 53,N
778901,1.42E+18,Make a judicial enquiry on Pegasus it is the time that the government show nothing to hide.#Congress #Pegasus #ourIndia #ourindiaourpride #FarmersProtest_AtParliament #FarmersProtest,F
141149,1.36E+18,Feel bad for    See too supported #FarmersMovement  But happy  &  are getting credit   For supporting #FarmersProtest ,F
627587,1.33E+18," says he doesn't consider #watercannons #TearGasShelling as use of force, but rather only a deterrent.  Pride goeth before a fall.   #FarmersProtest #Haryana  ",N
970669,1.43E+18,Now the indian railways on sell who will be the next  #FarmersProtest  #9MonthsOfFarmersProtest 1/s?,F
401785,1.36E+18,?? oh you dirty little hamster. #FarmersProtest ?,N
11035,1.38E+18,????56 The recently enacted Farm Bills were passed without discussion with the people they will impact the most - the farmers.  Repeal the farm bills Farmers continue to hold peaceful demonstrations #FarmersProtest #??_????_???_?? 4695521?,F
893922,1.40E+18,In the home of democracy its smells like dictatorship  #TwitterStopHarassingFarmers #FarmersProtest #HumanRights ,F
944744,1.43E+18,"#FarmersProtest is a revolution and opened the eyes of many.   It will get worse before it gets better, but it will get better!   Can?t help, but think this could be the start of the 5,000 years of peace & harmony on earth.   #Farmers_RoaringInUP 2twitr/?",F
618483,1.33E+18,"#FarmersProtest | Government leaders are giving statements that they will continue Minimum Support Price (#MSP). What is the problem in incorporating this in the bill?: Ajay Chautala, Jannayak Janta Party (#JJP) founder.  #kisanandolan #FarmLaws #FarmersProtest ",F
77002,1.37E+18,?? Imagine how hard it will be for someone if it?s pregnancy test instead of Covid-19 and I bet results will be pretty much similar ??   #3MonthsOfDelhiProtest #FarmersProtest ,N
255413,1.36E+18,#FarmersProtest #RihannaSupportsIndianFarmers  indian govt. Chor h,F
958426,1.43E+18,DT Tanmanjeet Singh Dhesi MP: RT Tanmanjeet Singh Dhesi MP: Shocked to see a senior official (SDM) instructing policemen to ?break the skulls? of India #FarmersProtest activists.  Every? 4GzXK,N
893904,1.40E+18,We demand #VRSforMODI #OPS #BanEVM  #FarmersProtest #NPS_????_????? #StopPrivatization #ModiMadeDisaster #JusticeForEmployees #??????_?????_????_???  #NPS???????????????? #ModiChokingFarmersVoice #PrivatizationNoSolution #???_???????????_????_??? #PublicWithPSBs #???_????_???,F
289015,1.36E+18,  Thanks so much ?? for supporting #FarmersProtest,N
398140,1.36E+18,"Rihanna brings attention to the farmer protest in India,   ""The Largest Organised Strike In Human History""  Yes Its ..""The Largest Organised Strike In Human History""   #FarmersProtest",F
439461,1.35E+18,"Foot in mouth situation for all the inquilabis who didn't realize that they were glorifying impostors by justifying the act of vandalism as peaceful protests.   Not convinced?  ""Those were not farmers but goons,"" farm leaders clarified. #FarmersProtest",F
887444,1.41E+18,?????? ?????? ?????????? ???? ?????? ??? ????  Indian govt this is your policy to forget all promises after elections but It will never forget by Us that #BJP_DefamingFarmers #FarmersProtest ,F
64470,1.37E+18,"With 600 million+ farmers in India and climate change worsening, India needs to act fast. #FarmLaws would go a long way to addressing issues plaguing agriculture. Reforms are necessary, #Canada ought to support India?s efforts.   #FarmersProtest  ? ",F
996246,1.43E+18,"Over 600 deaths of innocent annadata, from 8 months farmers are at the doorsteps of the Government in Delhi. And this government of #Corporates are acting as slaves of its friends. Modi govt want farmers to be corporate slaves too.  #Modi_SlaveOfCorporates #FarmersProtest",F
460516,1.35E+18,"#FarmersProtest #DhokheBaazCaptain   At this point we need to rethink d watered-down version of #satyagraha (WITHOUT ANTAGONISM) which comes all naturally to us And If u want d appearance of a revolutionary without taking on d labours and risks of one, DON'T call urself a patriot 13?",F
624607,1.33E+18,"Support farmers,if you eat any food produced by farmers. Beacuse no farmer = no food and no food means no growth means downfall. And please Trend this hashtag. #FarmersProtest  #Farmers",F
72906,1.37E+18,"#?????_??_????_????? #JusticeForRanjitSingh  #FarmersProtest  Release detained innocent farmers, activists Citizens rights first! Jobs for youth Oust this evil thugs in power wreaking havoc in the nation, looting shamelessly; selling all national assets to crony corporate giants. ?",F
148365,1.36E+18,"This megalomaniac can?t stand criticism . #BJPGovtDictatingTwitter #FarmersProtest   ""Committed To Freedom Of Expression"": US Amid Twitter Row In India ? via ",N
424956,1.36E+18,"and if you do  movement impacts YOU, your home, your family, your  everything. #FarmersProtest",F
951482,1.43E+18,They work hard day and night in the cold and heat and rain and storms why are not being paid for their hard work ?   #FarmersProtest #RepealFarmLaws_MakeMSPlaw ,F
295516,1.36E+18," If one tweet rattles your unity, one joke rattles your faith or one show rattles your religious belief then it?s you who has to work on strengthening your value system not become ?propaganda teacher? for others. #SpinelessCelebs #FarmersProtest",F
266525,1.36E+18,Raise your voice for the farmers! #farmersprotest ,F
146347,1.36E+18,Their aim.. Hook or crook silence the farmers protest #FarmersProtest #FarmerProtest #IndianFarmersHumanRight #IndianFarmers #RepealThreeFarmLaws #IStandWithFarmers #BJPGovtDictatingTwitter #TwitterCensorship #TwitterVSGovt #RaviShankarPrasad #Modi #AmitShah ?,F
394702,1.36E+18,  Farmers are calling PM Modi since Last Year September more than 200 farmers died in the protest site because of cold and other issues and most of them are quite elderly. It's time world leaders and the UN should pay attention to this issue. #FarmersProtest the POTUS45 #JoeBiden,F
373396,1.36E+18,Amazing day for #FarmersProtest! It?s like the world just woke up to our 70 year struggle #JusticeForNavreet ,F
747195,1.38E+18,Cruel BJP put farmers in dire situation. #Farmers_vs_BikauModi #FarmersProtest,F
784984,1.42E+18, Laws passed undemocratically - for the the benefit of few corporate houses   #?????_??_??_????_???_?? #FarmersProtest,F
357974,1.36E+18, tikki Aunty #FarmersProtest exposed the #terrorism in #india now Shut up and hide your face if you have #respect,F
609578,1.33E+18,This Picture Speaks thousand Words #FarmersProtest #SpeakUpForFarmers  #Tractor2Twitter  #RejectFormerBills ,N
760020,1.38E+18,"World has witnessed atrocities used by BJP to suppress farmers protesting against three anti farming bills by their use of water cannons, barbed wire, tear gas and loss of internet. #FarmersProtest #FarmersProtests #FarmersAgainstAtrocities #westbengalassemblyelection2021",F
773291,1.42E+18,Farmer leader Shri #RahulGandhi ji towards Parliament by tractor in support of farmers  #FarmersProtest #FarmersProtest_AtParliament ,F
132016,1.36E+18,A daughter is arrested in mother of democracy..#FreedomOfSpeech #FarmersProtest ?,F
798759,1.41E+18,RSS and Modi terrorists should be investigated and punished for torturing and killing innocent people  #FarmersProtest ?,F
132002,1.36E+18,"Not sure if you are able to read this. Gurdaas Singh ji, 6, has been writing about his feelings about #farmersprotest . Awareness is key. As he wrote.. no matter what, we will always be in Chardikala. Creating #collectiveconciousness for all in #FarmersProtest #FreeNodeepKaur ",F
199492,1.36E+18,It's so disgusting to burn pictures of an child! #FarmersProtest  #GretaThunberg ?,N
718416,1.39E+18,  Couldnt agree more. Modi had all of 2020 to support/increase the health care infrastructure but he was too busy fighting twitter accounts supporting the #FarmersProtest  Blows my mind how India doesnt even have proper stretchers to transport people,F
729773,1.38E+18,Farmers are the source of life Don't muzzle that source  Repeal the laws and  Save lives   #RepealLawsToEndProtest #FarmersProtest ,F
403883,1.36E+18,"A lot of high profile Indian celebs in the U.S. have really dropped the ball in raising awareness on the #FarmersProtest, especially as clashes with Delhi police have become more violent & reporters being detained/censored on social media. Huge props to  for sharing this. ?",F
923334,1.44E+18,Unity is the real strength of Farmers Protest #FarmersProtest  #??_?????_????_??_?????? ,F
772987,1.42E+18,"Mahila Kisan Reached Jantar Mantar for the Historic Kisan Sansad  This historical Mahila Kisan Sansad will reflect the key role that women play in Indian agriculture, and their critical role in the ongoing protest too.  #WomenFarmers_AtParliament l #FarmersProtest |  ",F
178329,1.36E+18,"The leadership of Rakesh Tikayat, the leader of the peasant movement, should flourish. #SaveAmaravati #SaveFarmersProtests #SaveFarmers #FarmersProtest ?? #418DaysOfAmaravatiProtests ",F
589012,1.34E+18,Demonstrators protest against farm bill outside Indian Embassy in London.  #????_?????_????? #FarmersProtest #???????????  2cFIV-VYxl/,N
758280,1.38E+18,Farmers Revolution ?????? #FarmersProtest #AntiFascistRevolution2021 #Lashkar_e_RSS #BanRSS #FarmersAgainstAtrocities #Stop_Attack_Farmer_Leaders #Lashkar_e_RSS 1?,F
81979,1.37E+18,Women stand firm #MazdoorKisanEktaDiwas #FarmersProtest ?,N
740621,1.38E+18,         This picture is not related to #FarmersProtest  prevent yourself from sharing without knowing facts  I know we get emotional and upload things like  try to take precautions,N
886691,1.41E+18,Check Out Why it's So Expensive & How To Grow Most Expensive Miyazaki Mango[ FULL PROCESS]  ??780m18FjExI  #Miyazaki #FathersDay2021 #SundayMotivation #fathersdaygifts #FarmersProtest #FarmerProtests #farming ,N
409872,1.36E+18," If China had asked for MSP, these construction might've been in the border. Too bad it didn't. #FarmersProtest",N
640927,1.33E+18,#AAP leader #JarnailSingh detained for protesting outside PM residence                #MSP #FarmLaws #FarmerBills #Farmers #FarmersProtest  5306176-AA?,N
125061,1.36E+18," Delhi police Arrested the Army Veterans, u feel proud we felt like Sin. Shame on u, supporting farmers is a crime then yes I will keep supporting our farmers because m daughter of farmer.  #FarmersProtest",F
1002660,1.42E+18,We are not makers of history. We are made by history.   #FarmersProtest  #FarmersShineInOlympics ,F
739028,1.38E+18,Wishing you and your family a blessed Vaisakhi today and always. Let us keep our farmers in India in mind and heart as they continue their peaceful #FarmersProtest. May we continue to confront injustices wherever and whenever they occur. ,F
786002,1.42E+18,This BJP's agenda will never let you get up ever from the swamp of bullying.  Start protesting now if you want to save your existence.  #FarmersProtest  #BJPPoliceAgainstFarmers ,F
873634,1.41E+18,Protesting peacefully for your rights ain't a crime! Then why police is harrassing farmers!! #WhyChandigarhPolice_AntiFarmer #FarmersProtest ,F
663255,1.40E+18,Corporate and traders will be free to create artificial shortage of commodities in India hence this will enable them to menu plate the prices and charge the customers higher costs  Farmlaws make it easier for the corporates to manipulate market  #FarmersProtest,F
642093,1.33E+18,"    #FarmersProtest, including adivasis, from Madhya Pradesh, Maharashtra & Karnataka which was illegally stopped at the UP - Rajasthan border for almost 40 + hrs marches on to Delhi now to join the brave farmers from Punjab, Haryana, UP. Kisan Ekta Zindabad.  ",F
567720,1.34E+18,BJP supporters among 20 ?farmers? who backed new laws in meet with Narendra Singh Tomar.  #BJPGovt #government #tomar #NarendraSinghTomar #FarmersProtest #farmers #politicsnews #newdelhi #support #law #laws #politics #political #FarmersBill2020 #FarmersProtestHijacked ,N
175976,1.36E+18, #standwithfarmerschallange  #FarmersProtest   Biggest liar of all the time. Thank farmers every time you eat. You just want to divide india on the basis of religion and moving towards facisim.,F
96217,1.36E+18,"#Pagdi_Sambhal_Jatta  #FarmersProtest  Fighting to save our motherland, yet again Waheguru saade naal hai ?",F
271929,1.36E+18,"Cricketer Sandeep Sharma deleted his tweet, but kudos to him for standing against this regime. Looks like suppression from junior Shah has started... #FarmersProtest #IStandWithFarmers ",F
932499,1.44E+18," Richest farmers in the world! Protesting, staying in Delhi for more than a year! Who are the sponsors and what their motive? #FarmersProtest",A
289113,1.36E+18, Thank you so much #shameonbollywood #FarmersProtest,N
886922,1.41E+18,"Hello, I'm a Digital Kisan Bot trying to spread awareness about the largest ongoing peaceful protest led by FARMERS of India.  RT to support farmers and spread this message across the world. ??   #FarmersProtest   13:14:12",N
380750,1.36E+18,Comedienne  Singh joins  and  in supporting #FarmersProtest ?,F
762980,1.38E+18,Farmers are Pride of India but our Government does not accept this reality   #NationalJumlaDay  #FarmersProtest 4695521?,F
609490,1.33E+18,For the People who says only Punjab has problems with the FarmLaws. #TakeBackFarmLaws #TractorToTwitter #FarmersProtest       6yLLFFdF-gg,F
671065,1.40E+18,"Speak up, get them sentenced. Do not let this die down with a bail. This is deliberate for UP2022 & to target farmer's protest. If #FarmersProtest & others who have lost their loved ones to corona do not speak, death & apathy will be inevitable. #JusticeForFaisal #JusticeForAsif ?",F
645832,1.33E+18,?  Live discussion on Delhi border  #DilliChalo #FarmersProtest,N
688466,1.39E+18, I think people have started to realise that govts are good for nothing and they will have to stand up for each other. That?s the only way! ???????? #FarmersProtest #GlasgowSaysLetThemGo,F
580254,1.34E+18,"""If Farmers are in danger then the country is in danger""   #??_????_???_?? #??_????_???_????? #BharatBandh #FarmersProtest #8_?????_????_???",F
