,tweetId,renderedContent,stance
730040,1.38E+18,They would rather die than accept the farm laws. They're giving their lives for our future! #FarmerLivesMatter #FarmersProtest = #HumanRights ?,F
962625,1.43E+18,#Khattar_NewGeneralDyer  #FarmersProtest   Tweet /Retweet /share /Like,N
520097,1.34E+18,"#FarmersProtest just learnt that  submitted 2 crore signatures against #FarmerBill2020 I did a simple back of the palm calculation. On an A4 size paper with 100 signatures per sheet, you need 400 reams of A4 packs.  please check",N
580238,1.34E+18,"Dear #India, you are stepping into such a modern society, where it is not acceptable to take on other people's problems. And in everyday life, we are shutting ourselves off, by trying not to notice the negativity around us.From #Child developmental disabilities to #FarmersProtest",N
409715,1.36E+18," Yes, all know very well that your Annadata intrudes the border across from #Pakistan. We can feel your pain.  #FencingLikeChinaPak BC they are not #Farmer   #FarmersProtest #KisanAndolan",F
283385,1.36E+18,Hahahaha ????  #IndianFarmersHumanRights #shameonbollywood  #IndiaWithFarmers  #KisaanMajdoorEktaZindabaad  #FarmersProtest ?,F
378687,1.36E+18,  World being fooled by Congress & Left parties. Current system only benefits few rich Mercedes driving farm produce TRADERS FINANCIERS & POLITICIANS with stranglehold to EXPLOIT & LOOT poor farmers & Govt exchequer & avoid taxes.Entire protest engineered by them #FarmersProtest,A
960281,1.43E+18,"9 Months On Roads,  Near about 600 Farmers Lost Their Lives,  Still Fighting  For Their Rights & To SAVE FUTURE Of Country. #FarmersProtest  #?????_??_?????_?????_????? ",F
229016,1.36E+18,The necessity of women empowerment ??? #FarmersProtest  #FarmersAreIndia  #IndiansWithFarmars #WorldWithIndianFarmers ,F
471092,1.35E+18,Does this govt think farmers have no ???? Suspended does NOT mean repealed ???????????????????????????? #FarmersProtest ?,F
75683,1.37E+18,Join the fight to save farmers and farming in India.  Stop exploitation of farmers. Repeal black laws. Give MSP legal guarantee.  #TomarModiKisanVirodhi  #FarmersProtest 356/sta?,F
6712,1.38E+18,#NoVoteTo_LiarModi No Vote To PM who didn't speak a single word on the death of 300+ farmers during #FarmersProtest and still counting is on. #Shame,F
460923,1.35E+18,"Though I am not in support of this political #FarmersProtest even still they want to continue with the same, would have better if they would have decided not to protest on #RepublicDay .Could have gained some appreciation.  #Respect26January  #26?????_??_?????? ?",N
419924,1.36E+18, No ???? Nation with farmers #FarmersProtest,A
877955,1.41E+18,I hope someday the government will prioritize humanity ~ not tycoons   #SaveFarming_SaveDemocracy #FarmersProtest  #FarmersProtest ,F
560744,1.34E+18, Don?t give a shit about it. Tum hamari suno hum tumhari bhi sun lenge. #FarmersProtest #DafaKaroJioNu #BoycottAmbaniAdani,F
1010997,1.42E+18,Hashtag for today (02/08/21):  #7DaysOf_FarmersParliament  Tweet | RT | Share | Spread | Like #FarmersProtest,N
682719,1.39E+18,This protest doesn?t have a time frame . It will continue till the farm laws don?t get repealed #BoycottBJP4Farmers #FarmersProtest ,F
682727,1.39E+18,"A lot of people are afraid of heights. Not me, I?m afraid of widths. Steven Wright #BoycottBJP4Farmers #FarmersProtest",N
94888,1.36E+18,"There's a #FarmersProtest happening in Germany.   But the German Govt didn?t block their path with barbed wires, dig highways or label them Anti-National. And neither did the Govt declare it an ?internal matter? where others can?t comment. I guess that?s how democracies work. ",F
937909,1.44E+18,We want #JusticeForKarnalFarmers and everyone who lost their lives  9/11 SIEGE      SFJ #FarmersProtest #Karnal BOYCOTT  AI-161 AI-111 To #London          ?,F
179785,1.36E+18,"?They follow us everywhere?: BJP leaders face farmers? anger in Punjab, Haryana ?. #FarmersProtests #FarmerProtests #FarmersProtest   ",N
50149,1.37E+18,ISI balloon is refusing to give up critical top secret information. ?? Prayers for our Agen.?? #BreakingNews #FarmersProtest #Pakistan #PakArmy ,N
257333,1.36E+18," They should be repealed because if nobody raise their voice this time against these laws, such laws will continue to be imposed on masses. Laws should be made but not with mala-fide intentions. Wrong does not cease to be wrong because the majority share in it. #FarmersProtest",F
519437,1.34E+18,  BJP Mob Vandalises Raghav Chadha's office | #BJPKeGunde | AAP Vs BJP | Mad Mast Mota - 530Cz20  #KejriwalAgainstFarmBills #FarmersProtest #RaghavChadha  Please retweet and share this video if you like it. You may subscribe my YouTube channel.????,F
423376,1.36E+18,Urging World Leaders to assist PM Modi to see how these bills affect the entire country. #ModiPlanningFarmerGenocide #FarmersProtest                13hundal/statu?,F
5442,1.38E+18,"If you can?t save your MLA, your own partymen then kindly repeal the farm laws. Cos today is MLA tomorrow will be a normal person and you can?t save anyone that?s for sure.       #FarmersProtest #FarmLaws",F
274578,1.36E+18, Thanks for your supporting #shameonbollywood #FarmersProtest  #AntiNationalBollywood,F
51656,1.37E+18," When a government with all its power and influence has to intimidate, disappear, threaten, beat, name call, lie and torture its own citizens, then you know it?s a Weak Government.  #ModiHarassingProFarmers #FarmersProtest",F
918440,1.44E+18,"#FarmersProtest #ModiInUSA   ?700 farmers have died in the last 11 months protesting. These black laws should be repealed to save us. Please focus on our concern while meeting PM Modi.? Rakesh Tikait said in a tweet, tagging Joe Biden  1006129/",F
955448,1.43E+18,They are purposely targeting cities.   Urbanization has led to a polarization of it's own and many are apathetic to the #FarmersProtest because it doesn't affect their livelihoods.  No one cares till it affects them. ?,N
648738,1.33E+18,#FarmersProtest LIVE Updates: Traffic jam as farmers block Yamuna Expressway in Mathura  ? ,N
1007142,1.42E+18,"Repeal means revoke, reverse, rescind,  farmers have been clear about that from the get go. Opposition has also mentioned about repealing unlawful laws that were bulldozed forcefully through (attacking parliamentary / democratic procedures).  #FarmersProtest   2/",F
959603,1.43E+18,We will fight till we get justice?? Jai kissan ?????????? #FarmersProtest ?,F
995739,1.43E+18,Look whose poster i found at singhu border. What's written there in Punjabi? #FarmersProtest #FarmLaws #SinghuBorder #FarmLaws   ,N
403930,1.36E+18, A big slap on your face still apna dimg lga rhi ho . Such a idoitic women . No farmers no food . Fre reh lyi hawa te #OurFarmersOurPride #FarmersProtest #GodiMediaHataoDeshBachao #BJPGoonsAttackingFarmers woh ni dikh rha andhi bhagt #BJPdestroysDemocracy,F
358282,1.36E+18, Why weren't you talking about this?! #CheapPublicityStunt #rihanna #aukatmeRho #FarmersProtest   ?????? ,N
585974,1.34E+18,"If there is one indian flag then I support #FarmersProtest and   #8???????_????_???,#8_?????_????_??? , #??_????_???_????? ?",F
9616,1.38E+18,"  This is  and    Gagan, Aman support #FarmersProtest   Gagan,Aman kick the heck out of trolls.   Gagan, Aman both rock. Be smart, be like Gagan, Aman",F
362831,1.36E+18,Greeks failed  Mughals failed French failed  Portuguese failed & Britishers failed   to destroy nd invade #India now who the fuck are these #commies #khalistanies to destroy us . The people here are gr8 fighters . So don't waste ur energy nd money to destroy us. #FarmersProtest,F
525356,1.34E+18,"In my opinion, those who really want to know about #FarmLaws and why farmers are protesting should join this but only if you are really interested . #IndiaWithFarmers #BoycottRelianceProducts #BoycottPatanjali #BoycottJioSIM #Boycott_JioSaavn #FarmersProtest #IStandWithFarmers ?",N
202068,1.36E+18,Why is youtube removing songs in favour of farmer protests?This needs to be questioned.  #shame_on_you_tube   #FarmersProtest #IndianFarmersHumanRights  #HumanRightsViolation          ,F
762082,1.38E+18,   Farmers are Pride of India but our Government does not accept this reality   #NationalJumlaDay  #FarmersProtest,F
741266,1.38E+18,"Be a sikh , a learner always support #FarmersProtest  #DelhiPolice_TorturingFarmers ?",F
786679,1.42E+18,The demand should be to arrest the terrorists Police Not to release innocents   #FarmersProtest ?,N
918113,1.44E+18,"  I hope you?re aware your propoganda doesn?t work outside India - keep seething BJP IT cell , you guys are lame. #FarmersProtest the world knows the truth  and is watching - Keep supporting Indian farmers ? ",F
441064,1.35E+18,Minorities are not safe in under Modi Govt  #ModiYouCantFailFarmers #PeacefulProtestContinues #FarmersProtest ,F
355667,1.36E+18,"#FarmersProtest reality is that, Indian celebrities not scared from Govt they scared from  kutton ke muh lagta hai..#DeshdrohiBJP #FencingLikeChinaPak #DiljitDosanjh #FarmBills2020",F
690016,1.39E+18,There are farmers across the globe but only in India goons and terrorist do this in the name of farmer protests. And now Rape and murder are also added in the list. #FarmersProtest  #EidMubarak  #thursdaymorning #ThankYouGurudev #farmerprotesthijacked ,F
578649,1.34E+18,8hy12MRGSZ4  New video uploaded on YouTube watch now and give me ur support to this channel  #india #FarmersProtest #FarmerPolitics #FarmBills2020 #FarmersProtestHijacked #DelhiChalo #??????????_????????? #????????_????????,N
494274,1.35E+18,"We will celebrate #Lohri on 13th January by burning the copies of #FarmLaws. We'll celebrate #KisanDiwas on 23rd Jan, on the occasion of #NetajiSubhashChandraBose birth anniversary: Farmers' leader Manjeet Singh Rai .  #FarmersProtest ",F
794157,1.41E+18,Police are still harassing farmers - this time females at Tikri  #ModiAgainstFarmers #FarmersProtest ?,F
186726,1.36E+18,You have to watch this ??????????         #FarmersProtest ?,N
316450,1.36E+18,#farmersprotest  #justicefornavreet                    Please speak out against the human rights violations happening in India against peacefully protesting farmers ?,F
536462,1.34E+18,#FarmersProtest reached #Andaman & Nicobar Islands. Sikh residents rallied in front of the National Memorial Cellular Jail Today in solidarity with the protesting farmers.#FarmersBill2020 ,N
595876,1.34E+18,    You both are my Stars!!!  #FarmersProtest ,N
246707,1.36E+18,"#FreeNodeepKaur #FarmersProtest women are leading the way in this peaceful protest, keeping this KAUR locked up won?t change this, there?s many more fighting, India?s men who scare this easily to lock up a young woman because she?s chosen to use her voice. #nobackingdown",F
969385,1.43E+18,Samyukt Kisan Morcha's first all-India Convention started at Singhu Border for 2 days. This Convention is focused on expansion as well as intensification of the Kisan Andolan. #NationalConventionOfFarmers #FarmersProtest ,F
433953,1.35E+18,  #?????_?????_????_?? #????_????_?? #?????_?????_???????_??_????_??  #RakeshTikait  #FarmersProtest  #farmerprotest #gazipurborder  #???????_??????  Copy Paste RT,N
158845,1.36E+18,The move follows a recent notice to Twitter over non-compliance of order on removal of content on farmer protests #FarmersProtest in.h24.news/fS9,N
467271,1.35E+18,This is how Godi media follows.. #GiveJusticeNotDates #kisanandolan #FarmersProtest ? ,F
165341,1.36E+18,"Everything, even the #FarmersProtest is about BJP, Radharavi and Vairamuthu! She's totally caught up in a time warp!",N
492347,1.35E+18,"#NitinGadkari We now have surplus grains. Prior to 2020's production, we had about 280 lakh tonnes of grains in our godowns. We can give rice to the entire world. In case of corn, the #MSP is Rs 1,700, when the market price is about Rs 1,100. #FarmersProtest",N
629792,1.33E+18,"The #FarmersProtest is about uplifting the economic plight of all farmers and laborers. That?s the crux of this protest, and the reason why there?s been such a widespread coalition of support and participation.   Othering will not help, especially doing so on the internet.",F
665086,1.40E+18,1710 v/s 2021 #27Mayo 1770 #BandaSinghBahadur Made  #Sikhs Owners of #Lands #Punjab #May26Coup #India #Modi Forcible Grabbing #Sikh #Farmers Lands In #Punjab #FarmersProtest wil continue as #Khalistan is Solution     ,A
162834,1.36E+18,Thanks a lot #FarmersProtest #FarmersCallPMForDebate   ?,F
660021,1.40E+18,Manipulating the media is akin to poisoning a nation?s water supply ? it affects all of our lives in unimaginable ways. #???????_??_??????_ZeeNews #FarmersProtest,N
329213,1.36E+18,Thank you both for speaking about famers. God bless these innocent Indian farmers who are peacefully protesting against anti farm laws and this Dictator Modi Govt. Are killing many innocent farmers. #FarmersProtest #Farmers #IStandWithFarmers ,F
977309,1.43E+18,"Bajra has MSP of Rs 2250 per quintal in year 2021. Without MSP law, traders buy it from farmers for Rs 900-1000 per quintal. Same Bajra is being sold to consumers for Rs 4500 per quintal.  We are fighting against this ?organized & legalized robbery?.  #FarmersProtest ",F
29317,1.37E+18,"Farmers providing basic necessities to the underprivileged children in Delhi, i.e., food, education, clothing. There are many neglected citizens of Delhi that the government fails to see and acknowledge.   Pix via    #FarmersProtest #KisanEktaMorcha ",F
1006792,1.42E+18,More than half of Indian farmers are struggling with debts and committing su‹cides every year. Why Modi didn?t put efforts to resolve that serious concern rather bringing another agriculture-killing laws?  #????_????_????_?????   #FarmersProtest ,F
135583,1.36E+18,#ModiFeku is fake #CowardModi #GoBackFascistModi #GoBackSadistModi   #FarmersProtest #Farmers ?,F
659092,1.40E+18,"Two Words That Can Change The Way We Approach Life, ""Can I & I Can"" Think Which Option We Would Like To Choose.  #FarmersProtest",N
266634,1.36E+18,   have a break from this shambles and have a look into the #FarmersProtest,N
903942,1.40E+18,    This little known organization is working to support the individuals who lost a loved one in farmers protest  8Jw1R2?  #FarmersProtest    ,N
362093,1.36E+18,Roar of Tractor has gone Global.  We are getting Solidarity.      #FarmersProtest  #??_?????_???_??????  #Rihanna  #GretaThunberg,F
741446,1.38E+18," So true, and what a performance he's put at the expense of our country and its people #DelhiPolice_TorturingFarmers #FarmersProtest = #HumanRights",F
359338,1.36E+18, Yo are you In ??? I mean Bollywood  Never saw you  #FarmersProtest,N
200055,1.36E+18,"Democracy is not just right to vote, it is right to Live in dignity. #SaveDemocracy #saveindia #FarmersAreIndia #FarmersProtest #farme",F
390518,1.36E+18, Thank you Dr Ranj for tweeting about this. #IStandWithFarmers #FarmersProtest #India ????????,F
397074,1.36E+18, Thanks for your support to  Indian farmers ????????#farmersprotest,F
561921,1.34E+18,WATCH | Farmers' leader Rakesh Tikait talks about next move after govt's proposal.  #Farmers #FarmersProstests #FarmersProtest ?,N
489750,1.35E+18,Well explained  #FarmersProtest #ModiMurderingFarmers #FarmersProtests       ?,F
3655,1.38E+18,In solidarity with our #FarmersProtest a symbolic burning of Modi?s Farm Laws seems right on Holi #BurnFarmLawsOnHoli #?????_????_???_???_????? ,F
356663,1.36E+18,Hundreds of farmers can?t be misled. Today the price of petrol and diesel will be the prices of wheat and rice if these laws approved and farmers go back to their homes.  It is simply a organised land heist.  #FarmersProtest #FarmersStandingFirm #RihannaSupportsIndianFarmers ?,F
585648,1.34E+18,no farmer no food. we support farmers. #FarmerProtest #FarmersProtest #StandWithFarmerschallenge #Sikh #isupportfarmers #Tractor2Twitter  #JusticeForFarmers #saveourfarmersfrommodi #8??????_????_??? #nationalmediapaidbyBJPGOVT #KisanEktaZindaabaad #FarmerProtestDelhi2020 ,F
305158,1.36E+18,   Andbhkat sachayi ka sath dena seekho world is watching #FarmersProtest,F
480704,1.35E+18,Even a thousand bigoted presidents with all the armed forces in the world would turn powerless in front of a hundred conscientious citizens hell-bent on justice.  Support FARMERS???  #FarmersProtest   13:14:10,F
175678,1.36E+18,      #No_Farmer_No_Food  Please Support #FarmersProtest From Space. #FarmersAreIndia  #WorldSupportsIndianFarmers ,F
155964,1.36E+18," in support of #FarmersProtest  made a big protest with over 10,000 cadres, a day later clearing is on & president  ji with colleagues cleaning the office. These waste can be cleaned, can the other waste of this country be cleaned ",F
875902,1.41E+18,21st bhakt down dont dare to spread hate here #GurjarBoycottBJP  #Hinduphobic_Media  #FarmersProtest,F
361631,1.36E+18, We are united. Our protest is pure and pious. We don't need nationalism certificate from you or andhbhakats. We stand united for this very our own country's food security. #FarmersProtest,F
213921,1.36E+18,Just one tweet brings you this.!  But you already lost respect    You are not the God of Cricket You are the DOG of Cronies...  #FarmersProtest #IStandWithFarmers #BoycottBJP ,F
736917,1.38E+18,"#Modi_Killing_Mandis #FarmersProtest Repeal Farm laws If you support Indian Farmers, Please use daily # given by  with your tweets retweets quote tweets reply to someone everywhere. 39/stat?",F
42022,1.37E+18,Farmers are protesting for their rights. Their existence. That?s why their victory is inevitable!   #??????_?????_????_???? #FarmersProtest ,F
222345,1.36E+18,Totally Agree with  . #FarmersProtest #FarmersStandingFirm ?,F
64282,1.37E+18,"Rate The Debate presents to you 2nd Rate The Debate Conference. This Conference is scheduled for Tomorrow, Mar 6, 2021. 1 pm onwards. If you want to be a part of it, please feel free to register here: tdlx33i8n14R092ya #InternationalWomensDay  #FarmersProtest  ",N
458522,1.35E+18,Modi now scared & anything can happen in next 24 hours..!  4SEwsrpKE  #FarmersProtest #Dehli #Modi #India ,F
331451,1.36E+18,"Bollywood celebrities batting for political masters.  Foreign celebrities fighting for Indian #Farmers .  The only difference between Bollywood and Hollywood celebrities is ""SPINE"" ??  #farmersrprotest  #FarmersProtest  #KisanAndolan",F
38262,1.37E+18,"Does india rembr? In 1960 even after offering to pay $$ no one would give india wheat !!  After green rev , subs , msp india today is surplus ! And now Modi want to sell off grains for profit ! And the fool says nothing done in 70 yrs.. tere baap ne green rev kya? #FarmersProtest",N
792793,1.41E+18,"  Man stop. It's ok everywhere else!  8:39AM 7/13/21 Seeing that #FarmersProtest was so big; why is it that the virus has not run rapid. See, make it make sense. #COVID19",N
646582,1.33E+18, #Congress  buying tractor in large numbers for the #FarmersProtest?? . #escorts & #M&M on radar.  ??????,N
337444,1.36E+18, Those who support these anti-farming laws must not eat anything that is produced by farmers. Then they will realise their stupidity of blindly supporting the corporate-slave govt. We must save Indian democracy from facists asap. #IStandWithFarmers  #IndiaVsPMModi  #FarmersProtest,F
404397,1.36E+18," Great Rihana !!  Same attitude expected from others around the world.  must also intervene.  Farmers facing Internet ban, Water & Electric supply ban as well as stone pelting by ruling party goons as well as fake cases by Police. #FarmersProtest  #ghazipurborder",F
503550,1.34E+18,If  continues to ignore the kissans and  completes trade deals with India then im packing my bags and off to Canada I go  has more respect for our people #kissanmazdoorektazindabaad #FarmersProtest #india #canada #indiangovernment ?????,F
230401,1.36E+18,Very well structured reply by   to the   article.  In fact I have co-authored a piece on the Mandi System of India which is threatened by the new Farm Act. Have a look.  #FarmersProtest #FarmersAreIndia  globalviews360.com/articles/locat? ?,N
666381,1.40E+18,#farmersprotest #repealfarmlaws #stayunited we should stay united against fascist government. We have no other option. This is the only way of victory.??,F
831788,1.42E+18,"This regime is redefining citizenship in the most unjust, undemocratic terms; the whole world is shocked at what's happening in #India #FarmersProtest #FarmersParliament #FoodSystems4People        ?",F
161323,1.36E+18,  Fake news. There are only 16 million farmers in India.   250 million? Pass me the joint sweetheart. ????????   #FarmersProtest ,N
60980,1.37E+18,Please support the farmer's if you're eat food Reapeal three farmer laws or nothing #FarmersProtest #100DaysFarmersProtest #NoFarmersNoFood #FarmersCallBJPboycott,F
415927,1.36E+18,Langar militant first ever.... #FarmersProtest ?,N
896034,1.40E+18,Farmers To Protest At Raj Bhavans On June 26 Against Farm Laws   #FarmersProtest  ?,N
9942,1.38E+18,"#BharatBandh's impact visible in Andhra Pradesh. Shops, transportation & other services shut.  #??_????_???_?? to mark 4 months of #FarmersProtest. ",N
125308,1.36E+18, I proud of you mam very good ?? speech for delhi assembly ??????????kisan zindabaad???????????????#FarmersProtest,F
797803,1.41E+18,"No farmer, No food, No future!  #FarmersProtest  #??????_????_????_??????_????  ",F
941009,1.44E+18,Use bridgefy - offline messaging app or see my pin tweet/video.  #InternetBlackoutByBJP #KarnalProtest_AgainstLathicharge #FarmersProtest ?,F
737924,1.38E+18,United we stand ??  #?????_?????_????_???? #FarmersProtest ?,F
240260,1.36E+18,Bollywood is only following the script provided by their master Spineless and soulless   thanks for supporting farmers and taking a stand.  More power for farmers ? #FarmersProtest  #WorldSupportsIndianFarmers ?,F
876996,1.41E+18,"?If they plant nails, we will plant flowers?, exhorted Tikait on national television. #FarmersProtest  #7MonthsOfFarmersProtest ",N
342128,1.36E+18,"#Modi u have destroyed endia by ur own hands , #Khalistan zindabad, #IndianFarmers #FarmersProtest  World is with u #Sikhs ?",F
42508,1.37E+18,"Basic rights #PunishAntiFarmerBJP #NoVoteToBJP #FarmersProtest Repeal Farm laws If you support Indian Farmers, Please use daily # given by  with your tweets retweets quote tweets reply to someone everywhere. 2/sta?",F
684595,1.39E+18,???????? Big and interesting slap to Indians & Fascist  #AnupamKher #IndiaWithIsrael #IndiaStandWithIsrael #IndianIdol #IndianVariant #IndiaNeedsOxygen #IndianIdol2021   #IndiaFightsCOVID19 #IndiaTerrorism #IsraelTerrorism #FarmersProtest ?,N
788090,1.42E+18,"The question is, if not now when will we, the people will raise our voice against this injustice ?This revolution is the only resort we the people of India have to save our rights and democracy. #farmersprotest #????_???_?????_?????? ",F
135866,1.36E+18,The Golden song sung in 2017 but is still fresh in 2021   ???????  #FarmersProtest  #farmersrprotest #RepealFarmLaws #StandWithFarmers #Istandwithfarmers #NoFarmersNoFood ,F
293946,1.36E+18,Raise your voice for the farmers #FarmersProtest 1/stat?,F
72768,1.37E+18,  All well and good! But why no #GreenFuel mandate? Spillage of #Diesel & #Kerosene damaging ocean ecology & critical food chain!    still no #Biodiesel mandate! #farmersprotest ongoing    this is not a drill! ?? #JaiHind,N
678627,1.40E+18, Watch last night?s  interview with  for a masterclass in #Brexit smoke & mirrors.  Even  had to ask ?what does that mean? at the end of one particularly wordy nonsensical response.   #AustraliaTradeDeal #FarmersProtest ,N
497389,1.35E+18, Hypocrisy VS Democracy !! #IStandWithFarmers #FarmersProtest  #NoToFarmsBill2020 #JagoIndiaJago #JaiJawanJaiKissan  #AppniAkalLagaoDeshBachao,F
111414,1.36E+18,   Some innocent people were misguided and detained. Some are detained from protest sites. Have some humanity. We are fighting against govt policies. That's it.  #ReleaseDetainedFarmers  #FarmersProtest,F
637915,1.33E+18,"Barkha Dutt interviews actor Deep Sidhu instead of any farm union leader or farmer, rants against the actor and harps on Bhindranwale instead of discussing #FarmersProtest #StopTargetingFarmers #AntiFarmerMedia ",F
697951,1.39E+18,I will keep supporting #FarmersProtest until all the black laws get repelled,F
257013,1.36E+18,"    We need representation, emojis and icons for the largest protest in human history with participation of over 250 million farmers and their allies! #IStandWithFarmers #farmersprotest #FarmersProtest #FarmersProtests #RepealFarmLaws",F
259281,1.36E+18, Calmly with compassion for all.   #FarmersProtest,N
448934,1.35E+18,"  Whoever says this is disrespectful, show them the pictures of RSS/BJP thugs desecrating places of worship of other religions.  It's upto the Hindus to save Hinduism from the clutches of RSS/BJP  #FarmersProtest",F
388570,1.36E+18,Modi ji ka Vishwa bhar me danka (Modi ji is getting famous due to atrocities against farmers) #FarmersProtest #FarmLaws #ghazipurborder #farmersrprotest #kisanandolan #RepealFarmLaws 13567?,F
752549,1.38E+18,boAt Airdopes 481V2 Bluetooth Earbuds ? via  #lockdown2021 #BJPSthapanaDiwas #music #earphones #offers #Amazon #Deals #IPL #ipl2021 #cryptocurrency #ExamsCancelKaro #FarmersProtest #Galat #HanKer #OnThisDay #Messi,N
572531,1.34E+18,"No farmers = Barren land ! Our land is a Blessed one , so should be OUR Farmers? lives ! Requesting the government to understand their issues and favour them !  Humanity wins_We are together in this #FarmersProtest2020 #??_????_???_??  #NoFarmersNoFood #FarmersProtest ",F
525029,1.34E+18,No Farmers No Food!! Shame on Akshay Kumar.   #FarmersProtest #FarmersBeforeCorporations  ?,F
